text,labels
glamour travel luxe 9 world poshest safari upmarket safari become common currency recent year aiming attract superrich need go step ol lentille foothill mt kenya four luxury private house come private butler safari guide – else – dreamy horizon pool overlooking classic african scenery us750 night per person peak season us13500 six full run sumptuous chief house three night,expensive
belgrade bacchanal night serbiaâ€™s capital traditional theatre opera ballet go national theatre you’re stand swill stare type o3one gallery one popular art space belgrade rotating roster avantgarde exhibition serbian academy science art mostly feature serbian work throughout age don’t miss noć muzeja night museum you’re town may 60plus cultural institution open door 2am,theater
northland sea kayaking private road leading tauranga bay northland sea kayaking lead kayak exploration magical coastline cove sea cave island,canoeing/kayaking
foodie weekend paris ‘hautecouture breakfast specialist’ claus serf ultimate gourmet petit dejeuner breakfast – lavish array egg ham salami fruit yoghurt muesli bread pastry opt oldschool coffee croissant typical parisian cafe café saint régis near notre dame le petit fer à cheval le marais,breakfast
kawa ni kawa ni meaning river modern take traditional japanese izakaya pub middle westport offering visually appealing small plate enjoyed sake beer intimate environment best enjoyed friend find take classic japanese dish happy hour also – ahem – happy ending,river
getting around montrã©al sun rain snow boat trip st lawrence river cruise vessel ply st lawrence river day trip longer cruise useful sightseeing getting point point b popular option oneday trip montréal québec city,river
lamanai eco adventure one several tour operator based toll bridge south orange walk lamanai eco adventure good boat knowledgeable guide get top review,nature tours
thereâ€™s adventure every terrain arkansas mountain biking isn’t type cycling within arkansas entire delta region cut hundred mile scenic byway many relatively flat making easily accessible brand biking said delta bisected crowley’s ridge scenic upland spur add bit elevated biking otherwise lowland landscape,mountain biking
10 best wild swimming spot uk love taking dip stem regular swim london’s hampstead pond obsession waterlog late naturalist roger deakin’s classic book joy wild swimming book floating life regained retraced deakin’s seminal text took across uk search invigorating swim chance feel cool calming effect water hour i’d dried headed home,swimming
free cheap thing tampa tampa theater historic 1926 theater downtown gorgeous venue see independent film mighty wurlitzer organ play movie bad showtime limited one two film playing given day look special event adult admission 12 10 child 212,theater
christmas island australiaâ€™s best kept travel secret diver’s dream close 20m shoreline christmas island’s colourful fringing reef drop several kilometre abyss making unique scuba diving planet 60 dive site choose keen diver could easily spend week ticking rare specie dragon moray eel hybrid fish don’t occur anywhere else keeping eye spinner dolphin whale shark,diving
mountaineering kayaking paragliding finding adventure austria road cycling cycling sound music country aside place musical filmed austria’s lake district salzkammergut cycling heaven home eddy merckx classic think lush alpine meadow crystal clear lake something else dear heart every roadie – plenty place kaffee coffee kuchen cake,road cycling
cyclo conservation career association dedicated supporting cyclo bicycle rickshaw driver phnom penh tour great way see sight themed trip pub crawl cultural tour also available,cultural tours
nosara retreat sweet retreat set yoga camp open individual traveler search quiet getaway rocky path wind shady garden connecting appealing room main house larger villa openair yoga pavilion rugged fiveminute walk beach,yoga
perfect day athens port guide piraeus piraeus culture stop imposing recently renovated municipal theatre piraeus stand city’s central square host top theatre music dance performance,theater
greenway bike share top tip cycling nyc like pro dont forget fun sound corny cycling really joy whether you’re recreational rider daily commuter cycling new york one way remind you’re flowing vein one world’s greatest city explore city ground get fresh perspective even longtime resident new york discover thing never knew existed pedal past twowheeler,road cycling
ayurdara run thirdgeneration ayurvedic practitioner dr subhash delightful appointmentonly waterside treatment centre specialises personalised therapy one three week also offer yoga ₹200 it’s vypeen island 3km north fort cochin ferry jetty,yoga
get around switzerland bicycle whether you’re looking crawl hill road bike tear trail mountain bike simply fancy gentle pedal along one switzerland’s shimmering lake switzerland brilliantly set cyclist many city free inexpensive bikehire scheme bicycle ebike rental usually available train station,road cycling
stay luxury new york city island first time summer new luxury retreat opened july 11 giving traveller chance go glamping island close season october site room 100 overnight guest – offer hotelstyle service dining site truly spectacular event whole site rented wedding retreat dining option public space site programming activity people visiting island collective retreat even working local group create event “act platform local community experience island unique way live music innovative dining wellness retreat thought leadership summit much more”,expensive
hotel restaurant zur post bright pleasant hotel heart town offering 25 large comfortable room plush colour additional fancy touch brass bed lamp there’s sauna facility massage free bike use guest understatedly stylish restaurant offer mainly nononsense austrian classic,hotel
uk longest mountain bike trail beginner open ‘at 5km long kermit trail offer awesome introduction downhill mountain biking stunning location’ said martin astley founder director bikepark wale ‘theres nothing like anywhere else uk unique way beginner family enjoy first taste fun sport safe controlled manner’,mountain biking
authentic outdoor adventure bosnia hercegovina country’s ambitious biking endeavour new crossborder trans dinarica mountainbike trail route designed twowheeled version via dinarica hiking trail begin slovenia traverse croatia end bosnia hercegovina focus technical singletrack riding there’s also mixture wider dirt gravel road path bosnia expanding moment it’s 10day journey connecting mostar sarajevo overnights village hotel bb homestays,mountain biking
national motor museum behind impressive 1852 stone flour mill birdwood national motor museum collection 300plus immaculate vintage modern classic car check delorean motorcycle finishing point adelaide annual bay birdwood car rally,museum
motorpoint arena 7500capacity indoor arena staging concert bigtime comedian disney ice champion league dart,live music
6 best thing arunachal pradesh outdoor adventurer rafting fishing mighty brahmaputra river known siang river curve way arunachal pradesh crossborder river entices angler kayakers rafter explore flowing water diverse wildlife journey eastern himalaya tradition fishing area play important role culture local adi people one largest tribal group state,river
eat stay play washington san juan island prefer someplace secluded lovely lakedale resort tenminute drive friday harbor lodging option anywhere else island addition traditional room available lodge glamping option like luxury yurt wifi indoor plumbing private hot tub cabin airstream canvas tent option pitch tent enjoy amenity one campsite property sits 82 acre boast three lake guest access complimentary barbecue kayak water tricycle lawn game,resort
ruby pride luxury hotel wellmanaged midrange hotel modern furnishing room airconditioned attractive furniture minifridge flatscreen tv staff switched helpful short walk secunderabad station kilometre metro stop,hotel
kayaking kayaking organised least 24 hour advance take place april november dry season though dependent state river time,canoeing/kayaking
nan another great location slow running golden gate park san francisco park 1000 acre offer variety running path perfect prefer slower pace park also home number attraction including california academy science de young museum easily make day,park
larvik maritime museum 1730 brick structure immediately east harbour home maritime art number impressive model ship colin archer famous norwegian naval architect shipbuilder larvik beautiful skate jærbuen ii dating 1898 also usually docked,museum
get active bermuda snorkeling scuba diving hundred shipwreck dot water around bermuda it’s often lauded one best dive site world many company like dive bermuda guided tour wreck – expect see wildlife ranging parrot fish sea bream occasional sea turtle,diving
go philippine celebration around christmas new year notably holy week build easter make colorful fascinating time visit country many resort triple rate around popular period,resort
19 incredible place visit costa rica right explore reserve hiking five trail making 8km 5 mile marked wellkept selfguided pathway monkey sloth toucan commonly spotted experience rainforest canopy tree climbing ziplining flight toucan us49 per person join birdwatching walking tour,nature tours
reinvention reno new reason visit nevada biggest little city long ago midtown district holdout drifter washout traveler mostly stuck block casino downtown large resort south day determined collective smallbusiness owner transformed district diverse area momandpop shop trendy restaurant boutique store,resort
vermontâ€™s 7 best hiking trailsâ first mile mellow outandback hike climb consistently 2263 ft top along way you’ll step rocky stair traverse mossy waterfall splash swimming hole you’re game finally top mt hunger’s rocky summit 360degree view spine green mountain north south west new hampshire’s presidential range east,swimming
steamboat bike park even firsttimer really really fun rent topend mountain bike right base trail follow greenblueblack outline winter hiker also enjoy scenic gondola ride village pleasant creek running really sleepy summer,mountain biking
bumbershoot fair people – seattleites otherwise – would say seattle finest festival major art cultural event seattle center labor day weekend september bank live music comedy theater visual art dance also bank crowd hotel stuffed capacity book well advance,live music
canoe canada wilderness iconic waterway canada synonymous canoeing country’s waterway initially navigated open boat first nation people later european settler used avenue discovery trade route canada’s many river allow modernday adventurer explore country’s remote wild area river like yukon snake south nahanni iconic surprisingly easy access thanks many canoebased outfitter guiding company,canoeing/kayaking
roxy tribeca cinema pocketsize 99seat movie theater basement roxy hotel feature eclectic everchanging calendar cinephiliac delight arthouse feature documentary hollywood classic international movie curated series andy warhol archival film,theater
noukhada adventure company specialising local exploration paddle local tour operator run kayaking trip mangrove forest allowing experience abu dhabis mangrove habitat close interested ecology unique environment opt twohour ecotour also night tour monthly fullmoon tour great hotter summer month,nature tours
everything need know traveling south korea korean countryside beautiful mountain river make beautiful vista life lived differently city population older – people 40 decamped city – pace slower least trip get city immerse traditional side korea,river
crown promenade crown’s fourstar option linked mother ship read casino air bridge offer large modern gently masculine room luxurious bathroom big window flatscreen tv,hotel
garda bike shop big professional outfit take care cycling need popped inner tube week mountainbike hire also run tour bikeshuttle service,mountain biking
siam river adventure operation since 2000 outfit running whitewater rafting kayaking trip good reputation safety professionalism guide specialist rescue training additional staff located dangerous part river throw rope trip combined elephant encounter overnight village stay,canoeing/kayaking
delta desert river tale three safari botswana aquatic environment permanent blue sky allow enjoy quintessential okavango experience – poled myriad reedlined channel mokoro traditional dugout canoe without sound symphony played nature eye almost water level you’re truly immersed environment spotted world’s smallest frog grasping single reed gazed blue sky flecked pink soaring flamingo high water also enables use modern watercraft venture delta reach exciting big five sighting powerboat,canoeing/kayaking
best place go alaska explore stunning wilderness mendenhall glacier glacier often discussed linguistic flourish – noble ice majestic mountain sublime grandeur there reason onlooker raid dictionary describe unique beauty place like mendenhall glacier demand weakkneed prose take hike around river ice tumble mountain stand gaping mouth ice cave watch parade iceberg glacier discharge mendenhall river may last scientist say gone 25 year,river
meet bud breakfast colorado hotel weed enthusiast offer include ‘bud bar’ offer free sample different weed guest hotel’s happy hour there’s cannabisinfused massage offer there’s also traditional wake bake breakfast hotel’s website describes “every morning egg cracked bowl packed guest gather sunny communal dining area famed wakebake breakfast session grab fresh cup coffee uplifting sativa strain enjoy gourmet breakfast prepared care skilled onsite chefs”,breakfast
luxurious outrageous spa wellness treatment around worldâ nestled among rolling countryside northern san diego calavie spa resort offer guest truly pampering experience perhaps mildly intimidating staff guest ratio 51 spa’s star attraction range vinotherapy treatment including hallowed grape skin wrap us oceanic clay enriched cabernet extract slather skin winescented wonder,resort
national ballet canada national ballet canada known fulllength classical work sumptuous set made beautiful theater come early ballet talk preshow qa learn production dancer rush standingroom ticket available performance day,theater
responsible volunteering thing know go finally always ask question volunteering child grandchild brother sister situation kind volunteering would oknot ok many people want spend hour orphanage say karen people take fluffy toy lolly go kick ball kid often constant stream people little benefit child creates situation another sight tourist trail,with kids
lonely planet best beach europe 2015 getting half fun beach fourmile walk nearest road path winding moorland grassy sand dune view milelong beach overlooked limestone sea stack buachaille finally open feel like ample reward sweep sand cliff around freshwater loch back face water stretch arctic tall tale ghost shipwreck mermaid add garnish people find tramp around beautiful place poetic enough,beach
pelican travel guided birdwatching tour nature walk 40 lv per group conducted englishman mike black pelican lake guesthouse srebârna pelican travel also arranges birdwatching outdoor tour throughout bulgaria afield romania danube delta,nature tours
strangest night weird wonderful afterdark adventure scenic sunrise florence italy unashamedly favoured haunt come nightlife cheap bar soulless nightclub play brand insipid chart music regardless world one night however walking home one florence club four morning friend shocked find 19thcentury piazzale michelangelo full people couple young old gathered around single accordionist slowly swaying time musician’s soft melody arm loose around waist eye wrinkled tired smile,bar
burgas sand sculpture festival artist create fantastic sand sculpture summer july work put display end summer ezero park near northern end maritime park,park
firsttimers guide san juan island everything need know go kayaking away coast worry join organized trip shearwater adventure orca considered one best kayaking school state offer tour lesson,canoeing/kayaking
namkhong resort main drag semisecluded compound tropical plant handsome wooden structure popular spot even fancooled sharedbathroom cheapies go quickly expensive room come aircon private bathroom there attached restaurant swimming pool bonus,expensive
united kingdom 10 best food experience full english breakfast many people england make toast bowl cereal dashing work visitor staying hotel bb undoubtedly come facetoface “full english breakfast” dense dish typically consists fried bacon sausage egg tomato mushroom baked bean fried bread,breakfast
venice kayak venice watery pursuit kayaking probably best fun without licence pirouetting skill gondolier wellplanned tour head remote island broad garden lagoon including san francesco del deserto,canoeing/kayaking
spend perfect weekend paris dinner pop lateopening shakespeare company magical warren booklined room making way one quarter famous jazz club like caveau de la huchette atmospherically set medieval cellar used torture chamber french revolution convivial café universel finish evening stroll along seine lamplit bridge paris illuminated monument reflecting rippling water cest magnifique,live music
pedersã¶re kyrka dating 1400s one region’s oldest church king gustav iii sweden personally signed plan expand church cruciform though builder ignored instruction demolish towering spire church located 2km south town centre,church
dear breakfast believe breakfast meal time day craving egg benedict frenchrun allbreakfast allthetime cafe whitewashed arch place come novel idea lisbon godsend breakfastphiles,breakfast
moville boutique hostel breakfast selfcatering choice tea coffee milk breakfast cereal organic sourdough bread guest use kitchen prepare meal owner fount information area rich history folklore,breakfast
top 17 experience ukraine discover mystery eastern orthodoxy descend catacomb see mummy muchrevered saint excursion holy holy eastern slav founded cave monastery 1051 lavra filled goldendomed church baroque building orchard religious ceremony take place lavishly decorated iconfilled interior accompanied beautiful choir singing attended crowd pilgrim monk great collection scythian gold microminiatures museum located premise,museum
affordable luxury abu dhabiâ€™s top 10 best hotel abu dhabi used cheap destination today rank among expensive city living world luxury however much affordable visitor many imagine city world offer comfort price,expensive
paris v rome iconic city right city cultural diva dark seduces befitting european capital paris rome entertain lavish pageant opera theater live music cinema summer many nightclub city close art festival pop social life spill outside onto café terracestitched square park starspangled riverbank along seine tiber,live music
richard branson another private islandand stay guest stuck choice come finding place relax chat resort boast plenty space medium room tennis court pool outdoor cinema 15person spa twostorey openair balinese wantilan relaxing gathering there also riverboat transfer guest mainland resort arrange activity food foraging surf lesson beer wine tasting cooking masterclasses guest,resort
christ church cathedral christ church working anglican cathedral there’s charge visit private prayer attend service – ask porter main gate evensong celebrated 6pm day,church
konoba baå¡ta looking hearty cooked breakfast heading lake grab seat reedshaded terrace relaxed tavern order omelette english breakfast three fried egg ham cheese return later day local fish dish grilled meat pasta even couple vegetarian option,breakfast
hotel cala dâ€™or built 1932 used military barrack spanish civil war fourstar dor returned life 95room hotel overlooking rocky cala dor tidy room balcony garden sea view – latter definitely edge – minimum fivenight stay applies peak season,hotel
portugal tip traveller breakfast portuguese don’t really breakfast midmorning peckish portuguese nibble one mountain fresh pastry including sinful conventual cake one many pastelarias won’t go past bica espresso standing bar,breakfast
best rainyday activity vancouver embrace light across town christ church cathedral tranquil spot shelter inclement weather celebrated stained glass window offer chance rainbowlike hue – whatever weather,church
da vinci road tour life leonardo five minutes’ walk south 16thcentury monastery italy’s largest science museum museo nazionale della scienza e della tecnologia 10000item collection alive invention whirr rattle huff steam including 130 model leonardo’s invention like batwingshaped flying machine cannon propellerpowered boat ideal inquiring young mind laboratorio handson exhibition designed get kid using problemsolving strategy leonardo – brace eureka moment car later,museum
bequia beach hotel sprawling lowrise resort privileged location right friendship bay manages balance style elegance unpretentious atmosphere accommodation range gardenview cottage suite overlooking water villa private pool finished topquality furnishing,resort
english exotica guide isle scilly bagging miniature hill roaming seaweedstrewn beach fun alternative perspective bryher hire boat kayak paddleboard bennett boatyard take water there’s better way admire island’s raffish charm,canoeing/kayaking
best u state park state visit 2022 alabama – gulf shore state park warm lightblue water white sand beach endless horizon stretching gulf mexico town gulf shore represents particular kind oceanside fantasy two mile beach well nature center 9am 4pm monday friday dog park roughly 25 mile hiking cycling trail – keep eye peeled gator,park
shevchenko park central shevchenko park one postsoviet park sit hour watching family boarding kiddie train listening remarkably talented busker pondering shortness skirt height heel sure national poet might made flesh show – expression face tara shevchenko statue look though approves,park
egypt red sea coast promise day diving kitesurfing desert adventure complex date back 4th century ce house church palmshaded garden mudbrick monk cell art lover monastery st anthony particular must church st anthony part monastery home one important collection coptic art egypt,church
body body offer yoga class craniosacral therapy cosmetic acupuncture fullbody massage drop kid supervised play room 8 per hour destress,yoga
yoga barn chakra yoga revolution ubud life force yoga barn sits lotus position amid tree near river valley name exactly describes you’ll find huge space offering similarly large range class various yoga practice there also onsite ayurvedic spa garden cafe,yoga
grand prismatic spring 370ft wide 121ft deep grand prismatic spring park’s largest deepest hot spring it’s also considered many beautiful thermal feature park boardwalk lead around multicolored mist gorgeous pool spectacularly colored rainbow ring algae spring look like giant blue eye weeping exquisite multicolored tear,park
world best yoga spot luxurious como shambhala retreat remote resort maldives seaview suite cottage accommodation remain unconstrained new age austerity various combination spa treatment package soothe pummel shape openair pavilion regular yoga practice located sunrise side island,resort
scala hotel grand lobby awaits businessoriented fourstar hotel room lovely spacious standard one wooden floor higher category come carpet sitting room view av 9 de julio there pleasant large patio back good kid plus gym restaurant two business salon,hotel
archaeological underground museum open milan new archaeological museum opened ice house ten metre basilica di sant’ambrogio milan museum display amphora jewelry coin pottery found past 20 year result excavation courtyard cattolica university read italymagazinecom,museum
fiji perfect destination traveling kid resort size cater well kid make sure everyone comfortable taken care pack little one head fiji adventure they’ll never forget,resort
dublin literary pub crawl tour pub associated famous dublin writer surefire recipe success 2½hour tourperformance two actor riotous laugh there’s plenty drink taken make popular leaf duke duke st get 7pm reserve spot evening tour,cultural tours
world best city cycling unsurprisingly copenhagen came top latest report cycling way life danish capital resident 62 prefer commute bike rather car thats boast great network cycle path bridge make safe speedy cyclist zip city never put brake planning official continuously striving improve urban bicycling experience,road cycling
lodge uxmal room could nicer price can’t beat easy access ruin pool certainly add value expensive room jacuzzis don’t suppose stephen catherwood enjoyed luxury passed area late 1830s private guide ruin available m800,expensive
golden sand beach beach stretch mile east town along front st height summer local child may seen playing 45°f 7°c water memorial day may 100 masochistic resident plunge icechoked water annual polar bear swim,beach
village beach situated north coral beach section south beach free umbrella clean water snorkelling bar hosting loud party summer,beach
spend perfect weekend mexico city finish weekend flourish taking folkloric ballet palacio de bellas artes ballet take place every sunday evening starting 830 truly magical experience performer show dance around country colorful costume accompanied live music you’ll buzzing week afterward thinking city stole heart 48 hour,theater
