text,labels
wild swimming britain swimming nature simple sport don’t need mass kit go wearing pant note rew water probably won’t get much 18 19ºc unless weather warm it’s good idea swim someone else there’s much need worry access water see swim legally though need wary trespassing land rather water os helpful multicoloured map httpwwwoutdoorswimmingsocietycom tried tested location take jumper get even high summer,swimming
make time home lonely planetâ€™s free ebooks many people look take care lonely planet home wellbeing idea exercise help steer stressful time yoga stretch alleviate neck pain pointer backyard stargazing,yoga
spend actionpacked day denver 10pm comedy adventure take one city’s best kept secret – nocturne jazz club enjoy best live music you’ll ever experience show run tuesday saturday night every week,live music
sokolski monastery skyblue church posing forested valley centrepiece 1833 monastery began humble wooden church outside sokola cave falcon cave expanded outbuilding wellpreened garden today like many cloister bulgaria sokolski monastery sheltered revolutionary fighter vasil levski monastery 25km drive southwest etârs openair museum near vodnitsi village,church
butterfly tour take two wheel hit countryside cycling motorbike tour available studentrun company destination include pepper farm bokor national park kampong trach cycling tour emphasise interaction local community,road cycling
bodega del barbero tucked narrow street intimate bar wide range vino glass good tapa regular art exhibition live music outside terrace summer weekend,bar
krka monastery dedicated archangel michael monastery founded 1345 jelena šubić wife local croatian noble halfsister emperor dušan serbia however christian origin much older beneath complex natural cave system catacomb bearing early christian graffiti possibly 1st century local lore hidden church visited st titus possibly even st paul guided tour visit small section cave graffiti human bone seen cave system continues least 100m possibly couple kilometre,church
special around world 80 daysthemed culinary adventure coming london fancy taking taste bud literary adventure diving magical world jules verne’s classic novel around world 80 day good news february londoner able special dinner take inspiration book planned secret location,cultural tours
paliku beach unofficially known nudist playground scenic beach rarely swimmable rugged isolated terrain make fun beachcombing rock collecting along water edge windswept ironwood tree naupaka ilima flower add dash color even summer swell look manageable stay ashore unless experienced ocean swimmer,beach
best thing fiji 13 top reason leave hammock attend church service sunday you’re guaranteed goosebump – whatever belief – congregation harmonize heaven wander around indigenous fijian village neighborhood witness churchgoer dressed sunday best bold colorful pattern norm many accenting bright garden typically planted around house worship church welcome outsider though service always given english taking place taveuni’s wairiki catholic mission particularly divine,church
san juan nightlife best spot drink merry road tucked inside eclectic gallery inn hotel you’ll find another speakeasyinspired venue cannon club’s piano bar home one two steinway piano well labyrinthlike interior garden pool bedecked sunken sculpture full bar provides fuel sing along classic selfplaying piano night long,live music
entire swiss village want become hotel plan include turning town hall village church openair meeting place introducing shuttle service well excursion nearby point interest museum visit cooking class website swiss info report go plan old mill public bakery room dry chestnut also renovated according site rye hemp farming chestnut tree goat farming contribute towards revitalising local environment,church
best writing art retreat around world five intense day participant workshop structure setting style narration genre ranging memoir romance psychological thriller session supportive insightful challenging followed guided meditation working lunch paris’ bakery bistro – former haunt literary giant hemingway oscar wilde – long contemplative walk seine add fun sure spark fresh idea,cultural tours
california ultimate outdoor adventure sea kayaking fantastic way see island especially early fall fog clear condition ideal winter stormy it’s also great spotting whale wildlife,canoeing/kayaking
barcelona turisme walking tour specialised tour bookable tourist office include running shopping literary barcelona tapa tour civil war tour gothic quarter night park güell half dozen option,cultural tours
time theatre public house brewery cinema pub beautifully refurbished c 1940s movie theater screen see vat brewing beer imbibe andor dine dark surround screen showtime still eat drink watching old movie sport event theater ticket 5,theater
dudhsagar fall swimming possible fall compulsory life jacket provided ₹40 don’t picture taking romantic swim – plenty bather joining also walk distance head fall though it’s unwise without local guide real uphill slog resulting beautiful view,swimming
marriott courtyard location smack bang center historic downtown area main attribute reliable choice room fine gym indoor pool starbucks branch site,hotel
plan perfect big family holiday find kidfriendly activity everyone enjoy key successful extended family holiday everyone make everyone around great opportunity share family tradition someone show kiddy craft like knitting modelmaking screen time technology touchy subject it’s great kid relax movie older folk chat around table also want make sure everyone make memory together,with kids
perãº bike recommended shop offer repair mountainbiking tour run conventional demanding route downhill option multiday trip andes jungle area,mountain biking
centro de extensiã³n artã­stica cultural orquesta sinfónica de chile ballet nacional chileno two highprofile company based excellent theater run auspex university chile full season ballet choral orchestral chamber music well occasional rock gig,theater
female solo travel itâ€™s like travel solo 20 30 40 50 60 favorite travel experience decided book snorkeling experience great barrier reef sailed first whitsunday beach – paradise straight heaven – came snorkeling experience excitement diving made forget cannot swim overcame fear best experience ever,diving
bangkok bike ride division tour company spice road outfit offer variety cycling tour urban rural including night tour bangkok pickup available,road cycling
grande anse superb goldensand beach hotel development sight 2km north deshaies one basseterre longest prettiest stretch sand place secret though won’t alone it’s easy escape crowd walking bay however child head middle beach wave least powerful restaurant cafe cluster around parking lot,beach
world first dedicated hologram theater opening hollywood old 1920’s movie house hollywood blvd many life original pink pussycat porn theater 1970s pentecostal church many year hologram usa owner alki david created filmon’s hologram usa theater resurrect manner celebrity david also owner filmon stream hologram event theater globally,theater
ã‰glise notredamedesvictoires begun 1687 named french victory british 1690 1711 north america oldest stone church stand spot champlain set ‘habitation’ small stockade century small church completed 1723 inside copy painting rubens van dyck,church
boston tea party ship museum ticket expensive considering small museum save couple dollar purchasing ticket online,expensive
anse lazio anse lazio northwest tip island pictureperfect everywhere look often turn list world beautiful beach long beach lapis lazuli water great wave thick fringe palm takamaka tree granite boulder extremity there good snorkelling among rock along arm bay beachside restaurant despite popularity never feel crowded watch valuable,diving
gudanggudang yoga studio get away urban hustle bustle oneofakind yoga studio sanctuary peace experienced yogi beginner welcome range class include vinyasa jivamukti meditation class traditional javanese joglo hut particularly atmospheric – soothing sound water fountain there cafe next door,yoga
summer city 25 way beat heat new york 19 take quick spiritual retreat youll find noticeably lower temperature inside new york grand gothicstyle church massive cathedral church st john divine 1047 amsterdam ave w 112th st presence america largest house worship also evokes peace far fewer crowd st patrick cathedral something easily found bustling metropolis dont miss keith haring triptych behind choir,church
pivnitsa dark czech cellarbar – stone wall wooden booth long wood table – convivial place mug unfiltered house beer kelly 800t 05l come two type light dark also sausage steak meaty fare soak bar entered riverside radisson hotel,bar
yoga move hawaii practice yoga indiatrained iyengar yogini laurie freed teach class peaceful relaxing openair garden space,yoga
10 blissful beach long island ditch plain beach two mile past montauk edge long island cliffside view swell collide ditch plain beach shore one popular surf spot eastern seaboard—the wellformed wave setting first montauk point surfing championship way back 1960s,beach
best place watch wildlife iceland acrobatic humpback star tour school whitebeaked dolphin minke whale also spotted fairly regularly lucky may get see blue whale – guide report seeing great creature ‘with heart’ they’ll tell ‘larger volkswagen’ around 1 10 trip húsavík whale museum host 25mlong skeleton blue whale stranded beach north iceland 2010,nature tours
miniloc island miniloc island perhaps interesting archipelago island main attraction big lagoon small lagoon secret lagoon three photographed sight palawan big lagoon entered extremely shallow channel may swim lagoon leave boat outside inside surrounded jungleclad karst wall enormous natural swimming hole,swimming
best time visit bora bora budget blowout here guide june come june you’ll notice drop temperature night humidity decrease well making perfect month visit june also school holiday start north america europe bringing vacationing family many bora bora resort wind tends pick june creating ideal condition sailing kiteboarding decreasing visibility scuba diving key event hivavaeve,resort
best way get outdoors boulder mountain bike valmont bike park quick first foray boulder’s road reveal thing popular hiking boulder biking one america’s bikefriendly city wellknown training ground road cycling along winding mountain highway like lefthand canyon seeking get asphalt onto dirt enjoy ripping rugged natural surface trail 42acre valmont bike park,road cycling
expensive hotel suite around world 2018 elite traveler private jet lifestyle magazine released list top 100 suite 2018 feature sort place attract rich famous like george amal clooney mariah carey list also includes top 10 expensive hotel suite world one look might wondering best way save book truly epic stay,expensive
ecotourism may harm good say researcher ecotourism booming protected area around world receiving eight billion visitor year team pointed,nature tours
bodhi tree set lush hillside yoga resort traversed gurgling river complete waterfall setting gorgeous serene – perfect reconnecting breath body nature around affordable accommodation simple offering comfortable bed ample storage space well shared bathroom stone sink openair shower,yoga
lhong 1919 spanning group restored defunct chinese warehouse western bank chao phraya river concept shopping complex combine oldworld charm 19thcentury premise artsy shopping experience promised line designer store boutique housed within building good restaurant thrown along property riverside promenade complete eveningout experience,river
five festival sharjah sharjah world music festival top music event sharjah’s cultural calendar sevenday sharjah world music festival series goosebumpinducing concert held night sky spotlighting top talent around region beyond lineup span entire arc musical taste groove bouncy arab pop tap toe classic jazz treat ear soulstirring flamenco guitar began little outdoor event al qasba 2014 grown citywide extravaganza four scenic location including al majaz amphitheatre khalid lagoon flag island amphitheatre concert free ambience relaxed happy vibe around,live music
rivervalley campsite expansive rivervalley campsite lovely setting little ruaha river breakfast lunch arranged child three 11 year age pay half adult rate call advance rather turning ensure place open rumour closure time writing,river
south sea island resort captivas poshest resort complex expands 330 acre wildlife preserve cottage condo galore three pool including waterslides tiki bar six restaurant 25 mile whitesand beach guest spend day spa shelling beach playing water toy like waverunners standup paddleboards chartered boat,resort
kitesurfing caving canyoning finding adventure caribbean night kayaking kayaking bioluminescent bay vieques puerto rico extraordinary best done dark moonless night paddle stroke set weird whiteandgreen whorl light million tiny dinoflagellate disturbed emit glow fish zip away beneath tail flashing madly left right manta ray move like glowing space ship,canoeing/kayaking
go flow go flow run various guided kayaking canoeing trip starting 2½ hour along local waterway en route see heron otter egret kingfisher swan also hire kayak canoe set selfguided trip including multiday trip either wild camping bb stay transportation tofrom borris possible,canoeing/kayaking
indian river festival indian river festival feature full season performance canada finest musician celtic choral wonderfully acoustic st mary church,river
marthaâ€™s vineyard kid obamas taking week martha’s vineyard — can’t think better place kid there’s oodles thing kid jumping bridge jaw riding oak bluffs’ flying horse carousel hiking biking flirting edgartown harbor don’t think didn’t notice maybe feeding pig kidrun farm institute visited recently saw kid island usually part arc overlapping generation come life someday return favor kid,with kids
rebirth lisbonâ€™s cais sodrã© bridge tucked arch bridge rua nova carvalho cavelike music box name suggests music local right say one city best gig venue – lisbon one europe’s least expensive capital city rarely pay 15 euro ticket concert cover entire spectrum jazz indie rock metal british band like fink sweetvoiced soloist martina topley bird recently played dj take gig finish spinning everything house electro techno 7,live music
hotel amazing nyaungshwe expensive room optimistically named hotel attractively decorated mural cultural artefact cheaper room feel bit tight plain bright come verandah safety box competent staff,expensive
makapuê»u beach park makapuʻu beach one oʻahu’s top bodyboarding bodysurfing spot sandy beach park makapuʻu strictly domain expert handle rough water dangerous current summer wave action disappears calmer water allow swimming beach park restroom outdoor shower drinking water lifeguard beach short walk car park,swimming
sea kayaking serious paddler professional outfit offer kayaking expedition one 12 day using highend closedtop sea kayak handle better travel faster lowend variety also offer variety training course,canoeing/kayaking
awol tour discover cape town’s cycle lane superb city bike tour daily three hour r600 awol’s waterfront base pedalling itinerary include winelands cape point township masiphumelele – interesting alternative traditional township tour either bus foot guided hike table mountain r1850 also available bike rented r200300 per halffull day,road cycling
bar 1928 bar 1928 part rapidly growing bar restaurant scene south rua voluntários da pátria includes colab south ferro ceviche rj slow bakery,bar
hotel cairoli fivestar service threestar price book artful hideaway room 3rd floor towering palazzo themed modern artist feature work inspired like mondrian dorazio alexander calder add reading room chillout area small gym terrace ideal bolthole,hotel
nan slow running along stunning coastline algarve portugal peaceful serene experience take beautiful beach dramatic cliff move leisurely pace enjoying warm mediterranean sun skin,beach
best thing schweiz free switzerland budget forgoing hotel breakfast might save much sfr30 almost every café rustle decent coffee pastry bircher muesli rolled oat grain fruit yoghurt much le bakery butcher shop also good snacking hoof latter often sausage take away,breakfast
balloon beach fiery festival taitung taiwanâ€™s secret destination pacific coast east coast taiwan offer spectacular coastline asia crystal blue pacific ocean spread east endless rolling wave nearly arrowstraight highway 11 offer perfect view flat enough cycling pleasant drive passing tropic cancer halfway taroko national park taitung,road cycling
danube meeting serbiaâ€™s mystical east daylong busandboat tour river take best gorge booked serbian adventure starting belgrade novi sad call two bighitters golubac fortress lepenski vir different perspective entertaining story golubac’s mysterious past join twohour cruise local historian đerdap enthusiast jovan kocmanović quick fun way see romanera highlight iron gate including huge rock sculpture dacian king decebalus romanian bank danube speedboat tekija trip take one hour,river
denmark roskilde festival sell early thanks foreign influx roskilde festival offering year 180 concert nine stage among artist performing u legend neil young pj harvey red hot chili pepper wiz khalifa lcd soundsystem tame impala,live music
mexican witch guide occult new orleans elizabeth nola another place score perfect breakfast elizabeth’s nola serf oyster egg benedict biscuit sausage gravy give whole new meaning fromscratch cooking,breakfast
de lux hotel elegant fivestory commercial building downtown transformed luxurious hotel 51 room got character chain lot extra like lavish breakfast,hotel
four way experience beach fort myers sanibel beach bum 50 mile coastline world beautiful beach doorstep never far water fort myers sanibel matter sort beach holiday mind you’ll spoiled choice whether prefer private pool key cape coral familyfriendly getaway fort myers beach find shipwrecked snowbird sanibel take thing next level classy captiva essential away hour toe sand,beach
top 10 reason visit zambia canoeing zambezi get close personal sunbathing crocs thirsty elephant hippo pod leisurely paddle along lower zambezi river zimbabwe’s sandy shore one side 1200mhigh escarpment creating rift valley continually shifting landscape midstream island there’s hardly unpicturesque direction turn trip generally upwards two night bit preplanning strong triceps spend week sleeping wilderness camp way downstream dramatically beautiful mpata gorge,canoeing/kayaking
best thing slovenia mountain sea cycling champion slovenia become capital world cycling last handful year slovene last two tour de france race last three tour spain two last three tour slovenia took gold bronze cycling medal 2020 summer olympics reason dominance road landscape perfect developing champion discover training ground culture surrounding new slovenia road cycling loop though bike used route stay quiet asphalt road stage focus cyclist riding racing bicycle,road cycling
exploring phong nhake bang national park access park quite tightly controlled park still riddled unexploded ordnance officially allowed hike without licensed tour operator travel independently motorbike car ho chi minh highway hwy 20 cut park,park
world longest coastal path open england year flagship england coast path taking people finest important landscape england opening historic landmark natural wonder breathtaking scenery enabling visitor experience recognise value benefit environment natural england chair tony juniper said statement,nature tours
beinside good guide great range tour including unique food drink cultural tour muralart walk fashion tour standard tour well including chornobyl,cultural tours
sandy ground fronting bobbing yacht couple small pier goldensand beach calm shallow free coral making good spot splash snorkeling best rocky northern end – keep eye sea turtle scuba shack rent gear beach bar restaurant draw plenty punter especially weekend live band often play,beach
stanley theatre heritage 1200seat theater opened movie house live venue 1931 interior unusual mix era architectural fashion moorish art deco reading 2107 time open time capsule contemporary street photograph buried 2007 outside theater,theater
edinburgh pretty festival author past present figure prominently edinburgh literary lion born based include sir walter scott robert louis stevenson arthur conan doyle muriel spark well jk rowling ian rankin alexander mccall smith irvine welsh literary pub tour literary walking tour shortage good bookshop cater bibliophile 2004 edinburgh appointed first unesco city literature edinburgh book festival continues thrive writer museum scottish storytelling centre also easily accessible royal mile hill scottish poetry library home vast selection poetry book pamphlet poet feature regular evening event,cultural tours
nice nelson bay allday breakfast heaven hidden arcade near waterfront cafe serf eight variation egg benedict fluffy buttermilk pancake thickcut sourdough french toast served savoury side,breakfast
passport fee first hurdle lowincome traveler overcome despite travel accessible ever passport remain expensive luxury many wouldbe traveller around globe living budget,expensive
english national ballet one world’s best company english national ballet touring ballet company may fortunate enough catch one various venue london – principally london coliseum – watch rehearsal attend workshop purposebuilt new headquarters east london,theater
10 best u island camping destination 2022 expert tip ditch kayak campsite spell hike hardwood forest along gorgeous lakeshore trail wind four mile sea cave incredible lake superior view along way,canoeing/kayaking
beach day explore creteâ€™s beautiful national park south end 1159sqkm 447sqmile park amari valley wonderland small village dotted across hill dappled olive tree rosemary sensepleasing produce historic site abound namesake village valley beyond north margarites famous pottery workshop wait morning tour bus enjoy lunch cafe terrace sweeping view,park
new trace petrified forest discovered lesvos roadworks greek island lesvos mytilini new trace antediluvian forest discovered remains include huge number fossilised tree trunk well volcanic layer variety specie indicates existence large subtropical forest covered successive volcanic eruption new museum exhibition sigri devoted discovery famous petrified forest lesvos 20 million year old declared protected natural monument read greecegreekreportercom,museum
lavish airbnb rental way company acquires luxury retreat airbnb without list incredibly luxurious property – ranging lavish yurt oneofakind treehouses historic castle acquisition luxury retreat take thing next level incredibly swanky offering richard branson’s private necker island caribbean – set guest back 80000 per night,expensive
aria oasis green lawn scorched field surrounding airport stylish hotel offer better value city equivalent great option got badly timed flight there excellent pool lined lounger huge kid playground airport transfer included,hotel
fairhaven beach attractive wide expanse surf longest beach along great ocean road stretching 10km split point lighthouse eastern view there surf lifesaving club staffed daily summer holiday weekend till easter,beach
art san francisco bay area literary type check city’s annual litquake litquakeorg author leading lunchtime story session spilling trade secret drink signature lit crawl san franciscos main library host excellent highprofile authorreading lecture series author swing town tour make booksmith literary destination hemlock tavern edinburgh castle tenderloin liquid literary legend,cultural tours
antik sur live music kick around 8pm weekend often incurring additional fee ₺30 always made clear waiter check sitting,live music
camp door hell new photography tour central asia new tour entice photographyloving traveller want take camera epic adventure central asia – including night spent camping next “door hell”,cultural tours
childfriendly uk keeping family united across kingdom child travel mean miss fun here guide uk best familyfriendly attraction whether got short time london heading wale week,with kids
five oscarworthy theatre hollywood visit httpamericancinemathequecommastercalendarhtm schedule planned moviesupporting nonprofit american cinematheque theatre located 6712 hollywood blvd,theater
take new survey reveals family holiday plan year theme park holiday also popular two five traveller planning trip like disneyland universal seaworld third people surveyed planning trip internationally 20 saying going take ocean cruise research also showed people still love travel family one third planning trip family member bill sutherland american automobile association aaa said “families continue see value travelling way bond reconnect today’s busy world best way wrap family vacation start planning next one american starting do”,with kids
liquor room subterranean cocktail bar decorated manner prohibitionera speakeasy there lot room – room – hip lounge cat sprawl imbibe atmosphere wellmade cocktail there dancing boom room classy cocktail blind tiger room art deco elegance mayflower room,bar
