text,labels
aspen best thing every season go mountain biking snowmass bike park hundred mile mountain bike trail throughout roaring fork valley good place start snowmass bike park summer fall snowy ski slope transform lush wildflowerspeckled singletrack trail skill level bike park make easy spend time going downhill since hop elk camp gondola bike ride mountain – huffing puffing required unless want ride crosscountry 25 mile downhill trail spanning nearly 3000 vertical foot terrain beginner intermediate advanced rider want beat crowd trail like september november might best time visit aspen,mountain biking
7 best museum dubrovnik folk costume photojournalism entry several city’s main museum – including cultural history museum rector’s palace museum modern art dubrovnik maritime museum ethnographic museum – included dubrovnik museum ticket alternatively free entry museum mentioned along unmissable city wall use local public transport included dubrovnik card,museum
rhiz rhiz’ brick arch glass wall reminiscent many bar beneath u6 line status stalwart city’s electronica scene give edge competition blackclad boozer alternative set cram interior hear dj live act yearround summer large outdoor seating area fill overflowing,bar
omar cook campbell recommended local guide expert knowledge manzanillos national park omar offer discount bigger group facebook page,park
15 thing absolutely must central america visitor insist stuff plenty opportunity snorkeling around turtle small shark spying manatee kayaking lesserexplored part island,diving
kremlin ballet bolshoi theatre doesn’t monopoly ballet moscow leading dancer also appear kremlin ballet performs state kremlin palace bolshoi magical seeing show inside kremlin something special repertoire unapologetically classical box office near entrance biblioteka im lenina metro station,theater
casa choro attractive concert venue inside photogenic colonial building stage live choro brazilian sound wednesday thursday friday typically 7pm 8pm multistory space also small exhibition room covering brazil musical legacy,live music
international book fair 40 year thousand bibliophile descended costa ricas capital massive multiday literary event includes reading book sale presentation internationally renowned author,cultural tours
escape sleek modern spa mountain austria designed top relaxation destination resort feature number different facet including hotel restaurant cafés building housed hotel 200 year boast museum tell story history well adjoining manor house 250year old chapel offer 18 different room category double room “007” “fire” suite penthouse adlerhorst hotel also offer panoramic view zugspitze germany’s highest peak,resort
spiceroads offer variety regional cycling programme day night trip bangkok central thailand chiang mai weeklong journey linking thailand neighbouring country,road cycling
mother river journey along mekong lao slowly city suburb give way village rice paddy stilt house appear beside water cow pad along bank water buffalo cool shallow rain tree rise along bank occasionally golden top temple poke mist they’re reminder mekong sacred river river’s role purifier lifegiver provides central pillar buddhist belief lao ancient temple line jungled bank including oldest holiest wat phu,river
24 hour cape town 4pm next cape town stadium built 2010 world cup green point urban park bay rd beautifully designed urban oasis fabulous kid play area watered stream flowing table mountain meander along sea point promenade taking atlantic coast view there’s always piece public art along grassy strip that’s become local talking point,park
iglesia de santiago 12thcentury iglesia de santiago three romanesque apse backing pretty little plaza de la constitución city oldest church,church
new disney website help keep child entertained home child school home thanks covid19 pandemic many parent finding hard keep entertained disney come rescue launching new website filled free activity child adult enjoy,with kids
praia bateria perfect stop track cute little beach scallop sand wedged long wall rock swimming like private bath definitely couple first choice either want intrude someone else,swimming
lilla hotellet calling little hotel big heart homey appealing little place really pleasure everything bright friendly including staff cute spa restaurant bar summer dinner buffet 180kr excellent room spacious bright – elvis ask room 9,hotel
guided walk architecture pub literature among theme 1½hour guided stroll run tourist office many leave forum centre office based booking advised,cultural tours
11 irish castle showcase dramatic beauty historic ireland 11 donegal castle donegal castle guard picturesque bend river esque donegal built odonnells 1474 served seat formidable power 1607 castle rebuilt 1623 sir basil brooke along adjacent threestorey jacobean house,river
16 essential san francisco experience sip cocktail barbary coast bar friendly bartender highly suspect barbary coast san francisco’s gold rush–era redlight district circa 1849 night began smile 10cent whiskey could end two day later waking drugged sleep vessel bound patagonia doublecrossing barkeep shanghai kelly longer danger drinker san franciscan relax historically correct cocktail north beach’s revived barbary coast saloon including comstock saloon devil’s acre 15 romolo today’s saloon scene fitting homage drunken sailor yore iron stool absinthe fountain dim lighting reassuring barkeep banter,bar
picture palace cinema mostly landmark point reference old movie theatre gaming entertainment centre,theater
impressive allinclusive resort temping fate name aspirationally whatever standard impressive first word come mind looking midrange lastminute allinclusive resort good option staff friendly service slow lackluster ironically even premium side mattress sag ground wellmaintained kid club good one,resort
photograph yosemite like ansel adam lean lesson professional afternoon photo excursion worth,cultural tours
12 incredible experience cook island attend service cook island christian church sunday morning find majority cook islander church joining local service fascinating experience cook island christian church small whitewashed building 1850s local congregation welcoming visitor tradition christianity island date back arrival british missionary 1821,church
everythings better austin top thing texan sunshine 1 continental club considered austin preeminent music venue passive toetapping dance floor 1950sera lounge always swinging city best local act monday night catch local legend dale watson lone star serenading crowd country western tune continental gallery upstairs house regularly changed collection artwork sometimes host intimate live music session hiddenaway speakeasy vibe catch incredible jazz soul performance close personal,live music
beach dream beach dream sweet little familyrun resort direct beach access inviting pool area highly regarded barracuda bar grill room include bird nest loft area beachfront cabañas sea view hammock veranda bike kayak available guest,resort
6 place learn ayurveda yoga india 1 mysuru karnataka krishnamacharya’s yoga shala inside mysuru palace 1930s birthplace ashtanga iyengar style yoga mysuru always played integral role spread popularity yoga know today today yoga school mysuru concentrated around gokulam primarily residential neighborhood located northwest city center,yoga
greece move ahead dropping entry restriction may 1 may 1 visitor also enjoy full access museum archaeological site restaurant culture entertainment venue vaccination recovery certificate previously required,museum
sadarghat running calmly centre old dhaka buriganga river muddy artery dhaka lifeblood city nation exploring deck small boat sadarghat shodorghat see bangladesh grittiest panorama river life fascinating tripletowered ferry leer pintsized canoe country boat bump overladen barge barely inch clearance water,river
thomond park stadium 1995 2007 munster province rugby team undefeated legendary stadium also venue famous victory new zealand black 1978 2016 tour hallowed ground include dressing room dugout pitch memorabiliafilled museum easy 1km walk northwest centre along high st,museum
cheltenham literature festival one world’s oldest bookfocused festival kick 10 day autumn hosting astounding array talk workshop interview debate 600 top writer actor scholar literary figure headquarters montpellier garden,cultural tours
pointbar like many restaurantbars gueliz pointbars charm hidden behind high wall thickly draped door inside contemporary tapa bar revolves around lively openair courtyard order something eat want drink go tasty tortilla dh30 generously sized bargain perfect sidekick cocktail beer wine,bar
palm hotel spa really looking push boat wild south honest fivestar resort peacefully reposed promontory overlooking cerulean ocean sport wellfurnished unit designed finesse frustratingly three lodge face towards sea hotel steep path lead plage de grande anse,resort
wildlife pacific run marine biologist bahías complete whalewatching tour fullday excursion includes plenty explanation use underwater audio equipment listen giant mammal also includes meal local community chance relax empty beach freshwater swimming hole,nature tours
new england sport museum also display larry bird locker adam vinatieris shoe tony conigliaros baseball yes one landed left eye derailed career interesting exhibit showcase development woman basketball history football patriot – course – century red sox nation museum actually concourse area garden’s box seat tour begin proshop level two museum often close special event garden check website social medium visiting,museum
backstage bar chinatowns veteran gay bar found new life converted neil rd shophouse complete snug alfresco courtyard splash broadway poster friendly top spot chat flirt sit back people watch entry via side alley,bar
foster island wetland trail birdwatching popular swimming fishing kayaking it’s bad busy elevated hwy 520 roar island,nature tours
victoria creole capital seychelles plenty celebrate religious diversity display island nation often cited model religious harmony it’s long victoria visit grasp importance diversity faith small community elegant cathedral immaculate conception stand prominently north side town centre sunday pew packed catholic worshiper – rousing hymn flow door reverberate stunning stainedglass window anglican church may le historic crisp modern exterior graceful tower rise proudly centre town nearby also climbing skyward sri navasakthi vinyagar temple – gopuram entrance tower easily colourful feature capital south side town west inner harbour sheikh mohamed bin khalifa mosque,church
chicagoâ€™s 14 best city park picnic outdoor concert family fun best park admire plant flower built 1907 garfield park conservatory lovely spot spend hour sauntering around two acre glasscovered room brimming flower fern palm orchid,park
bike corris operation passport trail dyfi valley southern snowdonia host uk challenging downhill mountainbike race package including guided riding accommodation meal available,mountain biking
cape town hybrid culture breakfast lunch new look fashion food drink another combo that’s proving popular capetonians trendy de waterkant district stylish gayfriendly crowd hang loading bay reopened end 2014 slick expensive upgrade interior design spiffy café serf coffee ‘microtextured milk’ it’s heated 70 degree celsius dish crispy bacon avocado toast thursday evening popular burger night – book one two time slot available taste top grade patty premium beef vegetarian you’re done eating climb stair browse imported male fashion brand legacy acne stockholm orslow japan climb find dedicated outlet south africa premium australian skincare brand aesop,breakfast
madagascar island unlike kirindy baobab start trip west wildlife encounter walk among iconic tree,nature tours
spending diary spent fourday trip around nice 830am i’m bright early excitement holiday leaving everyone else sleep bit wander libération passing market full flower food towards centre settle fleur cafe breakfast outdoor seat sun french breakfast coffee croissant fruit toast juice €1150 wait friend arrive another cappuccino reading,breakfast
mar aventuras wellrespected company offering seakayaking island hopping multiday camping whalewatching excursion also kayak rental selfguided tour small hotel caters family suite us70,canoeing/kayaking
nihi sumba formerly nihiwatu luxury excluded celebrityfavoured resort might bump beckhams hefty price tag aside listed lowseason rate understand draw stunning accommodation every detail considered virgin beach crashing surf fold turquoise barrel sumbas ruggedly beautiful coast,expensive
van thanh mieu heart city encompassing temple lake topiary outline vietnam middle lush park wonderful place observe local life earlymorning exercise strangelooking contraption twinkling light dark lover gather bench around lake staring water keeping physical contact minimum,park
valamon luostari finland’s orthodox monastery idyllically located island juojävi visitor free roam site enter church first church made connecting two shed rustic architecture contrast curiously gilded icon modern church onionshaped dome incensesaturated interior featuring elaborate iconostasis visitor follow 45km marked walking trail pilgrim wooden cross located lake edge,church
peak paddle peak paddle take canoeing caving abseiling threehour fullday trip available canoeing april october caving abseiling possible yearround,canoeing/kayaking
best free thing mexico city wander half dozen block west alameda central oldest urban park america home famous diego rivera mural museo mural diego rivera appreciate free sunday alamedas east side send postcard palacio postal golden palace age,park
santa barbara california perfect weekend getaway surfing kite surfing scuba diving kayaking standup paddle boarding sup jetskiing take pick santa barbara adventure company hook really don’t want get water always horseback riding beach,diving
light lapland always dreamed chasing northern light camera hand here opportunity learn professional photographer tour range nightly photo excursion departing stf abisko fourday expedition comprise dogsledding gourmet meal icehotel visit accommodation stf abisko,cultural tours
booklover guide canada coast coast popular literary treasure pei include bookman bookstore charlottetown towering floortoceiling book also partake literary tour inspired anne green gable visit picturesque avonlea village filled replica building book,cultural tours
best swimming area near phoenix watersports desert salt river although great phoenix’s salt river tonto national forest twist desert 200 mile various segment decidedly different depending whether you’re looking chill time adrenaline rush head lower salt river mesa 40 minute phoenix lazy afternoon kayaking tubing propelled gentle current lower salt beloved spot wild horse frequently seen frolicking along shore also called mustang animal believed descendant horse introduced arizona spanish missionary 17th century,river
chchchchanges travel experience evolves family travel here’s funny truth childhood holiday matter much soggy camping forced endure many bad hotel buffet encounter big family feud erupt along way bad bit recede rosetinted sunset youth,with kids
yer bike cooley peninsula spectacular cycling bike delivered accommodation tourist office,road cycling
club med open ecoresort dominican republic archipelago another adultsonly village resort one focused romance making ideal couple newlywed archipelago guest accommodated exclusive oceanfront suite complete private pool outdoor shower private section beach,resort
california big sur still stunning open business despite landslide coming way keep tourist coming business opened spearheaded idea slowing traffic area general russell explained conversation regarding bus system let people park car monterey bus andrew molera state park underway project would relieve huge burden overcrowded highway 1 “it might blessing come this” russell said,park
mother iveys bay backed large caravan park accessed coast path small beach little beaten track mainly used camper caravanners – lack facility mean generally bit quieter neighbour according local lore named local wise woman witch lived nearby,beach
harryâ€™s trekking house located north town centre harrys longstanding budget option affable owner knowledgeable surrounding area organise reliable guide transport room plain bathroom basic mattress best expensive room aircon bicyclesmotorbikes us313 per day hired,expensive
12 best beach cape cod swim windsurf hike along varied coastline beach’s beauty beloved grasscovered dune fabulous sandbar wave daunting high tide time sandbar creates sweet shallow sharkfree swimming area – perfect kid,swimming
act fast kid fly free scandinavia airline u traveller need bit inspiration plan family vacation take note – one airline offering free flight kid u scandinavia finland,with kids
10 best thing san josã©s barrio escalante 4 catch awardwinning movie cine magaly inaugurated 1978 cine magaly costa rican icon country’s largest theater cine magaly differentiates movie chain curating independent awardwinning film across world also play host array film festival cultural event start experience attached kubrick café order anything pizza salad bring theater,theater
12 cannotmiss thing houston 12 national museum funeral history many major city art museum natural history museum houston one boast museum funeral industry might sound morbid national museum funeral history interesting institution blend history science art culture exhibit everything embalming wild whimsical coffin unique jazz funeral new orleans see victorian hearse learn presidential funeral find hispanic culture dia de los muertos exhibit,museum
bike saddle cycling focussed travel company arrange variety half full multiday biking trip around cape town winelands well afield,road cycling
ali hotel revamped ali hotel fanciest expensive place town surprisingly stylish modern though occasional fragrant bathroom drain prof window dressing go far still comfortable choice,expensive
yoga element studio run american adrian cox trained om new york teach primarily vinyasa ashtanga among respected yoga studio town highrise location help rise,yoga
dublin underground literary scene wall could talk dublin oldest watering hole would doubt colourful story reveal city literary great trying release muse pint dublin literary pub crawl tour simultaneously replaces brain cell drowns running 20 year take halfmile amble round atmospheric old bar immortalised dublin writer drink every stop led pair wellread actor soak witty irreverent literary anecdote delivered typical bawdy dublin humour might drop davy byrnes behan arrested joyce leopold bloom ulysses stopped gorgonzola sandwich glass burgundy head patrick kavanaghs local toner far beloved raglan road wb yeats would also sit sip sherry tour often end mulligan adopted canteen nearby irish press flann obrien column stomping ground wouldbe writer hoping bump editor education best,cultural tours
button factory multipurpose venue one night might shaking glow light thumping live set top dj next shifting foot foot member esoteric finnish band drag violin bow electric guitar string live gig usually followed club night,live music
siddhartha yoga centre expat recommended yoga centre perfectly located ghat view across ganges owner yogi siddharth offer 90minute beginner class ₹400 hatha yoga 930am private class ₹1000 5pm book online offer couple goodvalue modern room ₹1500,yoga
best place travel april 2016 man dive air grievance make amends atop platform case mishap dy clean slate today it’s considered male fertility ritual rite passage many young boy sa tribe small group tourist allowed watch land diving spectacle plan ahead contact tourism board,diving
jam cheerful bustling jam make great breakfast venue menu includes granola fruit pancake bacon maple syrup scrambled egg toast along excellent flat white good cake pastry range hot lunch dish irish stew shepherd pie lasagne,breakfast
beau soleil cafe bright cheerful cafe good spot breakfast pancake boudin omelet lunch chicken salad croissant grilled panini crawfish enchilada great family would order everything menu break bank,breakfast
kayaking kayaking calm crystalclear water dozen idyllic island great way explore banyaks rega anhar arrange anything beginner route multiday challenge experienced kayakers around 350000rp per person per day latter,canoeing/kayaking
templo de la compaã±ã­a de jesãºs small gallery m15 back church contains impressive 17th 18thcentury religious painting,church
antarctica planning trip lifetime chronicle adventure photograph magnificent ice formation terrain rare wildlife cruise specifically geared toward photography,cultural tours
syls cafe breakfast syls glory folk chitchat biscuit gravy pancake sausage heaping plate egg booth classic diner meaty sandwich burger beerbattered french fry lunch pot roast gravy dinner specialty pasty available anytime,breakfast
white nile bridge confluence blue white nile best seen bridge languid high point world longest river actually see different colour nile flowing side side blending downstream – although neither blue white dont attempt take photograph nile bridge numerous foreigner arrested,river
great barrier reef budget day trip green island tiny coral cay one resort luckily resort restaurant ice cream parlour watersports rental available day tripper take 30 minute walk around light sand beautiful island chance you’ll spend lot time enjoying crystal blue water fringing coral reef simply lounge day away beach great adventure greatadventurescomau run least expensive ferry option around au90 return,beach
exploring norway fjord kayaking fjord load place see fjord otter’s eye view quietly paddling kayak along waterway favourite spot lustrafjord might actually paddle otter paddle past colony seal kayak tour organised fjordseal based short distance town solvorn,canoeing/kayaking
survive city trip kid sure city trip kid may involve fewer cocktail leisurely meal lazy morning might otherwise that’s say can’t wonderfully fun stressfree urban environment offer plenty activity suit traveller age it’s rewarding see child getting much joy city,with kids
bark recreation best dogfriendly adventure florida “tail end” day southern tail florida baker’s cay resort key largo pet friendly get fourstar hotel tucked north overseas highway pet tikis scattered beach petfriendly menu even director pet relation maya “cay9” hit daily “yappy hour” 4 5pm pup wind get social,resort
ocean beauty aimed squarely honeymooner hotel boutique sense intimate feel also basic room stylish atmospheric little else hotel despite great spot romance – breakfast served balcony direct access lovely town beach,beach
sugar side delicious homemade wholemeal bread rich seed grain tasty pastry tart well panini pizza sandwich make popular breakfast fast lunch spot take away eat shady garden table part ten suite hotel,breakfast
hotel clelia especially good value offseason centrally located threestar hotel offer simple comfortable room bright summery hue hotel also offer holiday house sleeping two four people staff help organise scooter boat hire diving snorkelling tour guided walk,hotel
hg rodados mountain biking excellent way explore surrounding area good way travel ruta de los siete lagos rent bike around ar70200 per hourday,mountain biking
wine wilderness whitewater exploring adventurous side tuscany mere mention hill worried group mixed cycling ability you’ll pleased hear ebikes readily available rent frankly magical contraption take sweat cycling climbing challenging hill easy coasting along flat many case it’s possible steer clear traffic sticking strade bianche network old unsealed backroads named white limestone dust gravel formed,road cycling
river city boat tour checkin center located river city shopping centre office several outfit run dinner cruise along chao phraya river,river
hunebedden centrum centre also starting point several scenic themed cycling itinerary ranging familyfriendly 6km ride challenging 53km six hour download route map online,road cycling
best way get around utah scenic drive public transportation public transportation feasible state’s three major city you’re coming utah solely salt lake ogden provo three biggest city make corridor called wasatch front public transportation viable option considerably better many state even skier get public transport staying major resort,resort
surfing hiking diving kayaking costa ricas best adventure activity kayaking kayaking great way explore costa rica’s river lagoon mangrove paddle golf rica puerto jiménez might whale company elsewhere mangrove bahía drake teeming wildlife,canoeing/kayaking
resort recanto da natureza dont let word resort fool traveler far wide sing praise laidback atmosphere resort recanto da natureza like rusticchic country hotel great swimming pool attentive staff,resort
dog eared book vacation reading match castro scenery head dog eared wide selection san francisco literature lgbtq memoir novel censored elsewhere reading magnet local character bulletin board back store give lowdown local activism literary event,cultural tours
plage de lã‰tangsalã©lesbains generous stretch ashcoloured beach northern outskirt town great sunbathing swimming offer excellent sunset vista beach shallow bottom gradual slope swimming forbidden outside supervised area marked buoy,beach
