text,labels
ask expert go august spectacle another kind awaits singapore hattrick festival event ensures lively month visitor ditto ljubljana tonguetwisting capital slovenia primed celebrate roman root spanish city meanwhile become ghost town heat summer sends populace coast follow exodus chilled day serious siesta sandy beach beach busy maine state famous lobster festival get underway,beach
around bay day oneday massparticipation cycling event raise fund help provide disadvantaged child support education plenty route option everything 20km around melbourne substantial 300km bellarine peninsula mornington peninsula,road cycling
oxford star philip pullmanâ€™s muchanticipated book dust preparation new literary walking tour created fan experience oxfordshire’s twohour trek brings people key location book give visitor insight beautiful setting inspired pullman’s alternative universe you’ll even get speciallydesigned map show lyra’s oxford overlap world,cultural tours
5 best neighborhood cincinnati downtown cincinnati boast queen city’s best sight starting culturepacked cincinnati museum center national historic landmark multiple museum one stunning roof artdeco union station train terminal find 18 million artifact piece art archive across center’s interconnected attraction including cincinnati history museum cincinnati history library archive museum natural history science children’s museum crashcourse cincinnati’s culture history continues eastern section downtown city’s broadway hub aronoff center art tuckedaway taft museum art house work artist like rembrandt,museum
everyday exploration los angeles city ceaseless dreamsâ enter birthplace dream la world since first movie studio opened 1910s mean visit disneyland universal studio hollywood – entertainmentinspired theme park top destination reason – upcloseandpersonal view movie making you’ll want take studio tour warner bros paramount picture sony picture studio offer small group tour golf cart andor foot visiting recognizable set costume prop shop elsewhere get rush nostalgia costume prop photo memorabilia chunked chockablock inside hollywood museum keep eye academy museum motion picture scheduled open 2020,museum
best tip getting around anchorage exploring downtown anchorage foot heart anchorage also walkable district built easytonavigate grid downtown home numerous hotel restaurant bar shop art gallery state largest mall summer walk majority downtown hour also guided tour take delightful jaunt anchorage historic site – importantly past city best hotdog vendor downtown relatively flat walking suitable child adult physical fitness level,hotel
shimokitazawa three love three mission make live music accessible tokyo host 10 free event month otherwise average around ¥2000 lineup pretty random welcoming attitude mean usually good crowd take much – capacity 170 live show start around 6pm 7pm club event 1130pm,live music
alyeska resort single track trail mountain bikers love elevated tread singletracks suitable beginner well adrenaline addict tram chair 3 4 6 carry cyclist wheel way glacier bowl choose variety intermediate advanced trail lead downhill day pas lift 30,mountain biking
mango bay resort located tranquil beach mahoe bay lush quiet resort compound 12 italianstyle duplex villa expensive water edge one two bedroom full kitchen lowerpriced studio kitchenette short walk action kayak raft snorkeling gear free guest use,resort
komolo resort resort pompous description three plank wood bungalow bucket shower familyrun abode secluded islet lying 10minute boat ride gizo need throw care away three unit ideally positioned skinny stretch white sand offer killer view turquoise water,resort
panna tiger reserve panna le visited bandhavgarh kanha pench safari rarely booked reserve core zone panna national park 543 sq km beautiful forest grassland crocodileinhabited ken karnavati river flowing,river
consider staying airport hotel peak time also cheaper accommodation city need travel pas see sight they’re often better connected public transport network many hotel city public transport card zone go way airport make likely explore city central zone plus public transport great way peoplewatch,hotel
admiral twin drivein classic route 66 drivein movie theater two screen playing latest hollywood blockbuster arrive well showtime get good spot,theater
top u wellness retreat make year yoga nearly 40 million american counting practice yoga according several survey somewhere 815 attended yoga retreat even hope future yoga retreat offer unique opportunity really deepen yoga practice getting normal routine enabling focus fully physical spiritual emotional wellbeing,yoga
fahadan museum hotel arranged around delicately painted courtyard beautiful little establishment museum hotel room exquisite flamboyant moustachioed manager location heart old city popular teahouse main courtyard rooftop spectacular view one hotel well worth booking advance,hotel
chesapeake beach resort allinclusive resort packed activity room tropical character average key accommodation play tennis shuffleboard cool lovely pool perched waterfront head bit kayaking simply unwind drink thatchroof bar,resort
travelling budget asian city affordable accommodation price world you’re happy live life luxury expensive accommodation top five expensive city monte carlo monaco st tropez france reykjavik iceland san francisco usa new york usa unsurprisingly monte carlo’s infamy gambling destination mean fivestar hotel sure set back – average €2505 however it’s cheapest top five hostel coming €2800 reykjavik likely expensive budget traveller hostel cost €5056 home airbnb san francisco also highest peertopeer cost €25000,expensive
masonic restaurant ascend 2nd floor open door apartment 8 youll accosted unshaven bachelor type eventually open door reveal fancy beamed restaurant full masonic symbol advertised galicia expensive restaurant price 10 time higher normal…so make sure pick 90 discount card dim lehend beforehand,expensive
hidden cairo guide city bestkept secret you’re muqattam hill ridge upon muqattam hill home clutch modern coptic church carved cliff largest one church st simeon tanner vast rockcut amphitheatre seat 17000 worshipper thought largest church middle east,church
cafe fresq fresq always busy breakfast table spilling onto footpath good coffee gourmet breakfast pancake lunch item softshell crab burger,breakfast
inside californiaâ€™s new trailer parkthemed bar restaurant bar stock cocktail 40oz bottle olde english malt liquor served paper bag every night there’s different event including live karaoke visitor rock god night band play song night there’s human foosball plus regular battle decade party – ‘70s ‘80s ‘90s 2000s music accompanied 1 drink get expensive throughout evening “representing inflation throughout decades” said marvi,bar
sea dream hotel small dock back side give access one best swimming area island – deep usually free sea grass affords glorious sunset view even better panorama head rooftop lounge breakfast bike paddleboards canoe included,swimming
st paulâ€™s cathedral even presbyterian dunedin established church aka church england get prime spot octagon romanesque portal lead gothic interior beautiful anglican cathedral soaring white ōamarustone pillar spread vaulted ceiling main part church date 1919 although sanctuary left unfinished 1971 hence slightly jarring modern extension massive organ 3500 pipe said one finest southern hemisphere,church
erã¤matkailu piirainen special dry suit allow float along river rapid trip run activity company price include hot chocolate open fire afterwards warm also arranges selfguided multiday canoeing trip equipment route map cabin accommodation transport route start end point,canoeing/kayaking
need visa go st lucia st lucia ultimate island getaway adventurer lover anyone want spend day relaxing multiple tranquil beach luckily getting caribbean island relatively hasslefree even need visa here’s guide st lucia’s entry requirement detail apply nonimmigrant visa,beach
valle de la luna easy get car 4wd needed mountain biking great way get keep road trail make sure light reflective gear staying sunset park shoulder designated area – tear fragile desert tire track,mountain biking
strand building historic strand theater one key west’s great oldtime movie house used theater 1993 film matinee today it’s walgreens pharmacy exterior romantic ever,theater
chicago newly reopened maritime museum aim salvage city neglected sea history end 19th century help system canal lock city pulled one great engineering feat day reversing flow chicago river instead draining lake michigan short otherwise unremarkable waterway connected de plaines river flow mississippi basin eventually gulf mexico rest world,river
prince albert cycle well renting bike join threeday culinary cycling tour r4950 per person stopping local eatery partaking cooking course,road cycling
ride submarine biosphere reserve resort maldives four season resort maldives landaa giraavaru launch new world exclusive submarine trip board new luxurybrand submarine trip take two guest subaquatic dive explore maldives’ unesco biosphere reserve professional pilot take traveller see coral fish aquatic wildlife new perspective – allowing guest sit back enjoy magic sea without getting wet,resort
art deco journey shanghai belle ã©poque shanghai walking tour shanghaiwalkingtourcom also offer walk based around different neighbourhood including indepth french concession tour take area art deco gem historic shanghai historicshanghaicom cultural society dedicated shanghai architectural cultural heritage run regular event including monthly walking tour screening vintage shanghai film,cultural tours
baccus one busiest best established barrio barclubs place two floor drink special young crowd top40 latin international hit zero subtlety,bar
top 13 mustsee natural wonder indonesia test vertigo kelingking beach nusa penida bali located island nusa penida halfhour boat ride sanur one world’s stunning stretch sand accessible via dramatic high cliff position look stunning sweeping peninsula thin land bridge creates surreal sight cross get close viewing beach look relatively small high point pleasantly surprised go beach find long 80metre stretch pure white sand meet rich turquoise blue water manta ray dolphin sighting common hundred darting swallow inhabit cave,nature tours
hotel jardin cafetero close heart downtown hotel good value room much character particularly spacious comfortable contemporary spotless well equipped staff happy provide daytrip info,hotel
get around london tube train bike bus cycling surprisingly quick way cross london cycling generally great way get around city although city traffic intimidating lessconfident cyclist – important keep wit city tried hard improve cycling infrastructure opening new cycle superhighway commuter quietways back street cycle lane leisure cyclist public bikehire scheme santander cycle particularly useful visitor bikehire dock throughout city cost £2 unlimited journey 30 minute £2 additional 30 minute download app find closest bike spot available drop bike near destination cycling also excellent option exploring park along thames canal towpath,road cycling
jivamukti considered yoga spot manhattan jivamukti – 12000sqft locale union square – posh place vinyasa hatha ashtanga class center’s ‘open class suitable rookie experienced practitioner there’s organic vegan cafe onsite gratuitous celebrity tidbit uma’s little bro dechen thurman teach class,yoga
two day oxford morning start oxford adventure filling turl street kitchen lowlit city centre eatery serving locally sourced food great coffee breakfast menu served 81130am caters fan fried breakfast well whod rather healthier option,breakfast
hotel la torres control eastern area park run day multiday tour hiking horseback riding see activity desk hotel information already park,park
prinsep bar quiet drink dash history try tiny bar named james prinsep drew wonderful illustration varanasi’s ghat temple look 1830 copy benares illustrated glass case stick beer 25ml cocktail pour weak,bar
get around vancouver bicycle vancouver relatively good cycling city 300km designated route crisscrossing region,road cycling
best dampier peninsula middle lagoon there’s one place use phrase ‘full emptiness’ it’s empty beach middle lagoon perfect spot swimming snorkelling fishing lazing around book bring binoculars spot bird keep eye turtle dugong passing whale july september don’t miss ecofriendly whale song cafe nearby munget overlooking stunning pender bay cafe serf delicious mango smoothy pizza best coffee peninsula plus sleep clifftop campsite,diving
windy city wee one best chicago kid chicago good kid tot teen there’s something every child windy city – without aloof attitude supersized footprint make big city feel like nofly zone tiny tourist research many kidfriendly happening town chicago parent chicago kid discovering city family easy budget child age 7 ride free l train public bus age 7 11 pay reduced fare,with kids
meet host city 2014 world cup north brazil interior water encontro da águas meeting point negro solimões river popular excursion city majority trip jungle begin end stubborn refusal two river mix said inspiration wavy blackandwhite tile work plaza front teatro amazona reproduced famously along rio de janeiro’s beach promenade,river
festival art twomonth celebration original artwork almost form 140 exhibitor display work ranging painting handcrafted furniture scrimshaw plus kidfriendly art workshop live music entertainment daily,live music
la maison de cyclistes nerve center québec’s biking culture threestory house plateau essential stop avid cyclist there shop cycling book map guide vélo québec association involved developing one largest bicycling network north america travel agency planning biking trip info event cozy cafe,road cycling
wakã¼ lodge it’s hard fault wakü best expensive hotel canaima lush flowering estate ground prime view waterfall beach access suite peacock wandering around pleasure need book advance stay – contact office price release rate,expensive
hit beach st petersburg florida there’s never better time lace bathing suit lather sunscreen hit postcardperfect beach st peteclearwater growing buzz boast best beach florida — even u — truly something everyone along region’s 35plus mile stretch vibrant whitesand bliss,beach
top thing london see show theater london one best place world catch theater performance take opportunity visiting famous face glitziest production head west end area synonymous musical look mamma mia le misérables phantom opera big title include familyfavorites matilda lion king definitely family viewing book mormon hottest ticket town since 2017 hamilton victoria palace theatre ticket performance booked well advance,live music
slash singapore budget top free thing lion city prayer also pop majestic sultan mosque twin golden onion dome located centre malay heritage neighbourhood kampong gelam previously spelled kampong glam church thing st andrew’s cathedral singapore’s largest church armenian church smallest oldest built 1836,church
montage among top area resort montage wow personalized service extra like kid activity center bowling gorgeous spa trainer yoga fill whole floor aprèsski find guest side side black tie robe enjoying mulled wine smores braving heated alpine pool room go understated elegance,resort
egypt top 10 mustsee sight red sea egypt sun sand pyramid nile – red sea regarded one premier scubadiving destination world whether you’ve logged hundred dive you’re looking get certified don’t miss egypt’s remarkable underwater world one highlight particular thistlegorm huge underwater wreck discovered jacques cousteau descending 30m penetrating cargo hold you’ll find among living museum world war ii memorabilia including motorcycle jeep tank armoury,diving
san francisco budget golden city rhinestone rate san francisco welldeserved reputation expensive city entire bay area regularly top chart usa’s expensive place live,expensive
windy city wee one best chicago kid get around kid chicago taxi ridesharing service readily available – rather scrambling stash stroller secure child seat unfamiliar vehicle consider riding l chicago’s system elevated train subway major sight within easy walk elevatorequipped station indicated system map accessible icon ticket purchased station kiosk,with kids
8 adrenalinefilled u trip teen family cycling vacation cycling fantastic way enjoy outdoors explore new destination family plan itinerary better tap outfitter offer carefully curated cycling vacation tailormade family trek travel offer sixday guided bike tour vermont champlain valley green mountain includes cycling course 32 mile per day well swimming sampling ice cream ben jerry factory waterbury,swimming
take luxury private jet tour around world â€“ nearly 150000 four season hotel resort brought back world adventure private jet itinerary 24day trip take traveller seattle kyoto bali seychelles rwanda marrakech bogotá galápagos island miami trip sold last year first run company brought back second epic journey run 23 october 25 november 2019,expensive
yoga join cuban rhumba unesco intangible heritage list estimate number regular yoga practitioner worldwide range 30 million upwards half billion making one popular activity modern age it’s appropriate united nation finally added ancient indian tradition unesco intangible world heritage list,yoga
top ten experience tasmania declared national park 1916 mt field famed spectacular mountain scenery alpine moorland lake rainforest waterfall abundant wildlife it’s 80km northwest hobart make terriﬁc day trip park’s visitor information centre wwwparkstasgovau house cafe display park’s origin provides information walk,park
bachkovo monastery 30km south plovdiv stand magnificent bachkovo monastery founded 1083 complex date 17th century onwards church sveta bogoroditsa 1604 colourful centrepiece church decorated 1850s fresco renowned artist zahari zograf house muchcherished icon virgin mary beautiful mural found former refectory,church
getting around nepal easy right planning love mountain biking nepal zipping along back road ancient trail mountain bike favorite way explore rural nepal give independence travel pace veer impromptu detour side trip whenever choose also providing rewarding physical challenge,mountain biking
lhaki hotel popular modern hotel clean spacious room built around bright airy lobby entrance lane upper quarter town back room overlook noisy main road sure request nonsmoking room booking advised many travel agent lodge group,hotel
travel around wale enjoy epic scenery go many wonderful cycling route wale home uk’s spectacular cycling route whether you’re looking familyfriendly jaunt tough longdistance trail short easy route include bay trail cardiff canalside path ​between llangollen pontcysyllte aqueduct experienced hill climber geraint thomas wannabe spoiled choice brecon beacon snowdonia national park,road cycling
tanzania best beach swap safari serene sand beach trader set dawn sell ware sand sun sends pink purple ray sparkling sea spend day snorkeling diving jetskiing parasailing simply lounge day sand saving activity till sunset cruise handcarved wooden dhow traditional sailboat,diving
waimanalo bay beach park also known sherwood forest gang likening robin hood merry men operated 1960s broad sandy beach backed ironwood tree spectacular popular surfer bodyboarders countless wedding take place enchanting strand lifeguard campsite restroom entrance opposite honolulu polo club research time native hawaiian protest planned development taking place access beach park disrupted,beach
state history museum northern end red square state history museum enormous collection covering russian history time stone age building dating late 19th century designed russian revivalist style attraction – room style different period region highly decorated wall echoing old russian church,church
northern edge algonquin offer paddling trip woman getaway yoga retreat cabin tailored program throughout year office located south river camp en route access point one kawawaymoground lake northwest algonquin,yoga
free 19 music event set buenos aire free monthlong series screenprojected concert ballet opera begun buenos aire il festival de música second year feature 19 show outdoors near teatro colón 14 february,live music
scuba cancãºn familyowned padicertified dive operation many year experience scuba cancún city first dive shop offer variety snorkeling diving expedition including cenote night dive also run snorkeling diving trip underwater sculpture museum aka musa well outing see whale shark,diving
international centre yoga education research oneonone introductory yoga course 10 lesson 10 day given citycentre branch simply call day would like begin,yoga
coogee bay hotel enormous rambling rowdy complex pack backpacker live music openmic night comedy bigscreen sport beaut beer garden sport bar selinas nightclub sit stool window overlooking beach sip cold one,bar
hotel ferdinand arguably best threestar hotel town nothing fancy wellrun property smart nicely restored 1930s townhouse room fridge big comfy bed hotel within easy walking distance virtually everything including city beach mamaiabound maxitaxis leave across street,hotel
ivelo bucharest dangerous city cycling recommend nevertheless bikesharing scheme i’velo offer bike hire herăstrău park rental location near main entrance park expoflora zone phone consult website location detail,road cycling
byron yoga centre one longestrunning yoga school australia byron yoga centre offer daily class purna style – integrating physical posture breath control meditation monday saturday 4pm class 5 taught teacher training money go towards different charity also run variety yoga retreat,yoga
luxury travel tour put centre wildlife documentary obviously kind luxury adventure come cheap costing £140000172508 per group tour last eight twelve day include private viewing friend family finished documentary trip ended,expensive
basilica tapinu basilica tapinu accessible via short scenic walk għarb extraordinary sight – huge lone church gozitan hillock towering countryside malta national shrine virgin mary important centre pilgrimage built 1920s site chapel local woman carmela grima claimed heard virgin speak 1883,church
best time visit poconos skiing scenic hike fall foliage outdoor adventurer love scenic hiking trail ample birdwatching shoulder season area’s lake river attract boater watersports enthusiast warmer month resort water park historic town dotting region appeal family kid age rain shine warm day cold,nature tours
peopleâ€™s park green oasis manicured ground ceremonial pagoda centre around visitor may paddle little boat summer month like park perimeter sealed high fence razor wire enter either via park north south entrance,park
offbeat boozing 8 best city bar crawl hop bar bar bar bar bar bar… ad infinitum seems there’s something everyone stylish quirky spot brushing shoulder ‘rock bars’ artinspired pub venue decked neon light host latenight dj long walk straightish line really can’t go wrong,bar
myanmar water world exploring inle lake take boat trip getting onto water naturally popular way experience inle lake every morning flotilla slender wooden canoe fitted longtailed outboard motor surge forth transporting visitor various natural cultural religious historic site nyaungshwe northern edge lake base setting motorboat trip – every hotel guesthouse town help arrange one wait boat captain approach street,canoeing/kayaking
48 hour singapore making southeast asia ultimate travel hub recover sensory overload traditional singaporean breakfast nearby nanyang old coffee ‘breakfast set’ come two runny egg kaya coconut jam toast cup caramelnoted kopi coffee mix egg swirl soy sauce dash white pepper use toast scoop creamy goodness,breakfast
colpo di pedale organises bespoke cycling excursion around langhe hill country wine district high pass seen giro ditalia annual multistage bike race also offer dozen different mountain biking itinerary youll need bring bike arrange rental separately call quote,mountain biking
massachusetts top free thing wicked fun free museum boston wide range free attraction including bunker hill museum massachusetts state house quirkier site like waterworks museum throughout massachusetts you’ll also find free college university museum including williams college museum art rose art museum brandeis,museum
sedia riverside hotel feel comfortable hotelstyle environment sedia good option resortlike complex feature outdoor bar continentalinspired restaurant huge swimming pool choose number room selfcontained chalet simply pitch tent take advantage hotel facility,resort
exploring family friendly side san juan yearround sunshine scenic beach array outdoor activity make san juan ideal locale family vacation,with kids
best time visit california january january wettest month california slow time coastal travel – mountain ski resort southern california desert hit stride famous new year’s parade held tournament rose college football game draw 700000 spectator la suburb pasadena,resort
take hobby traveling snuba anyone husband typically go vacation near ocean six year ago discovered activity called snuba – cross snorkeling scuba doesn’t require certification allows use oxygen tank stay water i’m strong swimmer found scuba training session overwhelming it’s good u we’ve sought trip since far we’ve done snuba grand cayman st thomas maui great barrier reef,diving
